Name	Place	Description	Pdf
Agata (P. et P. d')	Catane	Soufres.	Paris_1900_Italy_130.jpg
Antico Hercul & Cie	Cagliari	Mèches de sûreté pour mineurs.	Paris_1900_Italy_130.jpg
Bender & Martiny	Turin	Amiante brute.	Paris_1900_Italy_130.jpg
Berozzi (Léopold)	Spilamberto (Modène)	Poudres noires pour mines.	Paris_1900_Italy_130.jpg
Botto (Louis)	Rome	Pouzzolane des environs de Rome.	Paris_1900_Italy_130.jpg
Camplani (Nicolas)	Riva di Solta (Bergamo)	Blocs et échantillons de marbre.	Paris_1900_Italy_130.jpg
Canavari (Marius)	Pise	Publication scientifique.	Paris_1900_Italy_130.jpg
Chambre de Commerce de Carrara	Carrara	Marbre brut et travaillé.	Paris_1900_Italy_130.jpg
