Name	Place	Description	Pdf
Pettini Cino	Lucques	Appareil électrique pour fermer les passages à niveau.	Paris_1900_Italy_47.jpg
Société anonyme	Turin	Voitures pour chemins de fer.	Paris_1900_Italy_47.jpg
Société Italienne des Chemins de fer de la Méditerranée	Milan	Album. Dessins. Cartes. Photographies.	Paris_1900_Italy_47.jpg
Société Italienne des Chemins de fer Méridionaux (Réseau de l'Adriatique)	Florence	Locomotive. Wagons. Projet.	Paris_1900_Italy_47.jpg
Società Nationale delle Officine di Savigliano	Turin	Voitures de 1re et 2e classes. Wagon à bagages.	Paris_1900_Italy_47.jpg
