Name	Place	Description	Pdf
Société de Bienfaisance Mutuelle	Citta di Castello (Pérouse)	Status ; tableaux statistiques	Paris_1900_Italy_282.jpg
Société Italienne de Bienfaisance	boulevard de Courcelles, 92	Monographie, status, etc. Tableaux synoptiques	Paris_1900_Italy_282.jpg
Société Italienne pour la Protection des Enfants	Milan	Tableaux statistiques	Paris_1900_Italy_282.jpg
Société Niccolo Tommaseo de Patronage pour les Aveugles	Florence	Travaux des aveugles	Paris_1900_Italy_282.jpg
Société des Asiles de Nuit	Turin, rue Ornica, 123	Plans ; photographies ; diplômes ; tableaux graphiques et statistiques ; status ; réglements ; etc.	Paris_1900_Italy_282.jpg
