Name	Place	Description	Pdf
SARNO (Louis)	Naples	Riojuterie napolitaine	Paris_1889_Italy_30.jpg
SIVELLI (Egiste)	Gênes	Assortiment de bijoux en filigrane d’argent	Paris_1889_Italy_30.jpg
TOLOFO (Matthieu)	Naple, piazza Municipio, 10	Corail travaillé, squelettes, écaillé, I’vire du Vésuve, bijoutcries, majoliques	Paris_1889_Italy_30.jpg
UGOLINI (Jean)	Florence	Bijoutcries en or ct argenr avec mosaïques	Paris_1889_Italy_30.jpg
VENEZIANI & COPPINI	Florence, Pontevecchio, 9	Bijoutcries en or cl en argent, joaillerie en or	Paris_1889_Italy_30.jpg
