PrivRegNr,Name1,Vorname1,Name2,Vorname2,Name3,Vorname3,Titel,Schlagworte,Ort,Jahr,Einreichdatu
"",,,,,,,"Genaue Beschreibung der neuen Gegenstände meiner Erfindung ""den Dampf auf eine chemische",,,,
913,Bernhard,Anton,,,,,"Art nämlich durch condensirung und verdinung"" der Luft zum Heben des Wassers zu verwenden, -","Kondensatorpumpe, Pumpe",Preßburg,1821,07.11.1821
"",,,,,,,"der DampfCondensations Maschine""",,,,
914,Schmid,Fidelius,,,,,Beschreibung der ... gemachten neuen Verbesserung eines Essigerzeugungs Apparates ...,"Essig, Gärapparat",Wien,1821,07.11.1821
915,Pausinger,Leopold,Wurm,Franz Xaver,,,Beschreibung der neuerfundenen Flachs-Band- und Loken-Maschinen,"Krempeln, Flachs",Wien,1821,04.11.1821
916,Troyer,Joseph,,,,,Beschreibung der neu entdeckten Verbesserung der bestehenden Sparheerde,Kochherd,Wien,1822,18.03.1822
"",,,,,,,Beschreibung. Nach vieler Mühe des Nachdenkens und achtjährigen Kostspieligen Versuchen,,,,
917,Till,Anton,,,,,"gelan es mir endlich, das spanische Siegelwachs vulgo Siegellack in dreyerley Rücksichten zu",Siegellack,Prag,1822,04.01.1822
"",,,,,,,"verbessern, wie es meines Wissens bisher von niemanden gethan worden",,,,
"",,,,,,,"Beschreibung der ... Verbesserung, ..., daß zum Weben der Schawls, derley Tücher u. Westen etc.",,,,
918,Gratzl,Johann Michael,,,,,"auch die Kette aus feiner Wolle besteht, mithin die nämliche Qualität oder Waare wie bey den","Schal, Tuch, Wollwaren",Wien,1822,22.07.1822
"",,,,,,,"Cashemir-Schawls u. Merions Zeugen ezweckt wird, ...",,,,
919,Wappenstein,Ascher,,,,,Beschreibung der neu erfundenen Controlle - Maschine,"Registrierapparat, Spiel, Spielmarke",Wien,1822,23.04.1822
"",,,,,,,"Beschreibung der ... Erfindung, welche in einer neuen Art von Oefen besteht, sowohl zum Heitzen",,,,
920,Buresch,Karl,Mahalick,Thomas,,,,"Ofen, Kochherd",Wien,1822,20.09.1822
"",,,,,,,der Zimmer als zum Kochen/Braten und Backen mit Nutzen und Bequemlichkeit zu brauchen ...,,,,
"",Visentini di,,,,,,Descrizione della nuova invenzione che ... consiste in un Pomata che tinge in nero sul momento la,,,,
921,,Antonio,,,,,,"Haar, Färben/Haar, Schwarz",Venezia,1829,14.03.1829
"",Marco,,,,,,cappellatura ... [Pomade zum Schwarzfärben der Haare],,,,
922,Fagnani,Paolo,,,,,Descrizione dell'invenzione che ... consiste nel litografare sul vetro ... [Lithographie auf Glas],Glasdruck,Milano,1828,09.06.1828
"",,,,,,,Descrizione del processo praticato da Paola Pedretti nello fabbricazione dei pennelli ad uso dei,,,,
923,Pedretti,Paola,,,,,,"Pinsel, Malen",Milano,1825,27.12.1825
"",,,,,,,Pittori [Malerpinsel],,,,
924,Calderolo,Giacomo,,,,,Processo per la Preparazione alla Fabbricazione della Carta di Legno [Papier auf Hobelspänen],"Papier, Hobelspäne",Milano,1825,04.06.1825
"",,,,,,,Descrizione dell'invenzione che ... consiste nell raccogliere con mezzi semplicissimi un corpo aerei,,,,
925,Franco,Lodovico,Manin,Pietro,,,"forme, inodoroso, ed inocuo, fine qua inavestito, o trascurato, del quale abbondano i Canali, Rivi e","Kanalgas, Gasbehälter",Venezia,1829,08.08.1829
"",,,,,,,Lagune ... [Auffangen der Kanalgase],,,,
"",,,,,,,"Descrizione del miglioramento, che ... consiste in un nuovo metodo di eseguire le distillazioni nel",,,,
926,Jappelli,Giuseppe,,,,,,Destillierapparat,Padova,1826,14.04.1826
"",,,,,,,vuoto,,,,
"",,,,,,,"Zeichnung und Beschreibung der ... Erfindung, welche in einer Vorrichtung, / von dem Erfinder",,,,
"",,,,,,,"Thermograd genannt:/ besteht, mittelst welcher in einem verschlossenen Raum eine stäts gleiche",,,,
927,Girard,Philipp v.,,,,,"Temperatur mittelst eines Feuers dergestalt erhalten werden kann, daß dessen Wärmegrad die","Brutapparat, Thermostat",Wien,1822,01.07.1822
"",,,,,,,"verschiedensten Veränderungn erleiden kann, ohne daß die Temperatur des erwärmten Raumes",,,,
"",,,,,,,dadurch merklich gestöhrt wird,,,,
928,Groll,Joseph,,,,,Beschreibung meiner neuen Erfindung von doppelten Wagen-Federn,"Wagen, Federung/Wagen",Budapest,1821,24.02.1821
"",,,,,,,"Descrizione dell'invenzione che ... consiste in un regolatojo fumifugo, in un valvola califaciente, ed",,,,
929,Gay,Francesco,,,,,,"Rauchabzug, Kamin",Milano,1825,04.03.1825
"",,,,,,,in un cimarudo ventifugo ... [Nicht rauchende Kamine],,,,
"",,,,,,,Descrizione dell'invenzione che ... consiste in un nuovo metodo che intende d'introdurre per,,,,
930,Lanze de Peret,Pietro Giuseppe,Schmoll,Enrico Federico,,,l'illuminazione coll mezzo del Gas Idrogeno reso portatile condensato in recipienti ... [Tragbara,"Lampe, Abfüllapparat/Gas, Leuchtgas",Milano,1824,05.10.1824
"",,,,,,,Gaslampen],,,,
"",,,,,,,"Descrizione del miglioramento che ... consiste in una Stufa, la quale oltre di avere una graziosa",,,,
931,Gay,Francesco,,,,,,Ofen,Milano,1826,25.07.1826
"",,,,,,,figura ... [Verbesserte Oefen],,,,
"",,,,,,,"Beschreibung der Erfindung, daß das Eisen mit Gußstahl belegt, palttiert, oder fournirt wird, und",,,,
932,Feigel,Ferdinand,Gruber,Franz,Mueller,Andreas,"dadurch alle möglichen Schmid-Dreh- und Stemmwerkzeuge verbessert werden, daß der Stahl in","Plattieren, Schneidwerkzeug, Blech",Wien,1823,07.01.1823
"",,,,,,,dünneren Stahlblechen erzeugt werden kann,,,,
"",,,,,,,I. Descrizione dell'apparecchio con macchina apressione per la fabbricazione delle varie bevande,,,,
"",,,,,,,"ed acqua minerali ... II. Descrizione della composizione e fabbricazione delle ... Punsch spumante,","Punsch, Sodawasser, Limonade,",,,
933,Meyer,Giovanni,,,,,,,Milano,1826,21.08.1826
"",,,,,,,"Sod Watter, Limonea, Aranciate, Acque di Magnesia, Acqua Acidula [Schaumpunsch, Sodawasser,",Mineralwasser,,,
"",,,,,,,"Limonade, Mineralwasser u. Sauerbrunnen]",,,,
"",,,,,,,"Beschreibung ... der ... Erfindung welche ... darin besteht, einen sogenannten Flekenstein erfunden",,,,
"",,,,,,,"zu haben, womit man alle Gattungen Oehl-Fett-Wagenschmier- oder auch sonstige Schmutz und",,,,
934,Hoenigwald,Caecilia,,,,,,Fleckputzmittel,Wien,1824,31.08.1824
"",,,,,,,"Wachsfleken, aus jeder Gattung Stoffe, als Baumwolle- Seidenzeug Sammet-Tuch oder Casimir auf",,,,
"",,,,,,,"die leichteste, und geschwindeste Art selbst herausbringt",,,,
935,Fritz,Joseph,,,,,Beschreibung der Griesputzmaschine,"Siebwerk, Putzmaschine",Wien,1824,13.08.1824
